678,Chanca piedra,Amazon (Playwright),"EU Natural: ""Stone Breaker"" chanca piedra",https://www.amazon.com/STONE-BREAKER-Chanca-Piedra-Gallbladder/product-reviews/B01FERIHYE/ref=cm_cr_dp_d_show_all_btm?ie=UTF8&reviewerType=all_reviews,JC's Cool Movie Vibe!,Highly recommend - Chanca Piedra Stone Breaker.,5,1,2024-12-27,,1,,,,,,,,,,,,,,,,,,,,,,,,,,,,,,,7,LLM
679,Chanca piedra,Amazon (Playwright),"EU Natural: ""Stone Breaker"" chanca piedra",https://www.amazon.com/STONE-BREAKER-Chanca-Piedra-Gallbladder/product-reviews/B01FERIHYE/ref=cm_cr_dp_d_show_all_btm?ie=UTF8&reviewerType=all_reviews,Wendy,"First of all, the aftertaste of this product is refreshing.  God and this product, my stones are very tiny.",5,2,2024-11-27,,1,,,,,,,,1,,,,,,,,,,tiny stones,,,,,,,,,,,,,19,LLM
680,Chanca piedra,Amazon (Playwright),"EU Natural: ""Stone Breaker"" chanca piedra",https://www.amazon.com/STONE-BREAKER-Chanca-Piedra-Gallbladder/product-reviews/B01FERIHYE/ref=cm_cr_dp_d_show_all_btm?ie=UTF8&reviewerType=all_reviews,Miguel Mestanza Atiencia,"Day 1: I got these because i saw a lot of positive comments about these pills, lets see if it works. I will actually this comment letting you know if it works.EDIT: I had more than one month using it and i ejected 3 small stones",5,,2024-11-16,,1,,,,,,,,,,,,,,,,pills,,3 small stones,,,,,,,,,,,,,46,LLM
681,Chanca piedra,Amazon (Playwright),"EU Natural: ""Stone Breaker"" chanca piedra",https://www.amazon.com/STONE-BREAKER-Chanca-Piedra-Gallbladder/product-reviews/B01FERIHYE/ref=cm_cr_dp_d_show_all_btm?ie=UTF8&reviewerType=all_reviews,Amazon Customer,It worked right away,5,2,2024-11-12,,1,,,,,,,,,,,,,,,,,,,,,,,,,,,,1,,,4,LLM
682,Chanca piedra,Amazon (Playwright),"EU Natural: ""Stone Breaker"" chanca piedra",https://www.amazon.com/STONE-BREAKER-Chanca-Piedra-Gallbladder/product-reviews/B01FERIHYE/ref=cm_cr_dp_d_show_all_btm?ie=UTF8&reviewerType=all_reviews,Roman Bilyk,Great stuff! It really works and I was able to see the big stone after it came out in 3 months.,5,10,2024-10-13,,1,,,,,,,,,,,0,,,,,,,big stone,,,,,,,,,,,,,21,LLM
683,Chanca piedra,Amazon (Playwright),"EU Natural: ""Stone Breaker"" chanca piedra",https://www.amazon.com/STONE-BREAKER-Chanca-Piedra-Gallbladder/product-reviews/B01FERIHYE/ref=cm_cr_dp_d_show_all_btm?ie=UTF8&reviewerType=all_reviews,Lou Rain,"I bought this online and received it the next day  Started taking it and within 4 hour I felt the stone coming out of me, it felt like I was passing sand.  All my pain ended  Then I got a CT scan again and theDr. said it was gone and their wasn't a stone there anymore  I feel so blessed to have found this product online.  I highly recommend it",5,50,2024-10-03,,1,,,,,,,,,,1,1,,,1,,,,,,,,,,,,,,1,,,70,LLM
684,Chanca piedra,Amazon (Playwright),"EU Natural: ""Stone Breaker"" chanca piedra",https://www.amazon.com/STONE-BREAKER-Chanca-Piedra-Gallbladder/product-reviews/B01FERIHYE/ref=cm_cr_dp_d_show_all_btm?ie=UTF8&reviewerType=all_reviews,Kolef88,"Not being a great believer in herbal remedies, I was surprised that this worked.  A couple of months ago I had intense pain in my lower back and side which I thought may have been caused by a stones of some kind.  It did not feel like muscle strain.  The pain was bad when bending over or when turning over in bed. I couldn't get an appointment with a doctor, so I ordered the Stone Breaker and after three weeks the pain was completely gone.  Of course, correspondence is not necessarily causation, but I give full credit to Stone Breaker.",5,79,2024-09-28,,1,,,,1,,,,,,,,,,,,,,,,1,,,,,,,,,,,100,LLM
685,Chanca piedra,Amazon (Playwright),"EU Natural: ""Stone Breaker"" chanca piedra",https://www.amazon.com/STONE-BREAKER-Chanca-Piedra-Gallbladder/product-reviews/B01FERIHYE/ref=cm_cr_dp_d_show_all_btm?ie=UTF8&reviewerType=all_reviews,Watch Nerd / Member @sanantoniowatchclub*,"I took this in conjunction with lots of water, ibuprofen, and Tamsulosin. The stone came out about 29 hours after my first dose. I can't say 100% for sure that it was the only factor, but I can't deny the correlation.",5,25,2024-09-26,,1,,,,,,,,,,,1,,,,,,,,,,,,,,,,,,,,41,LLM
686,Chanca piedra,Amazon (Playwright),"EU Natural: ""Stone Breaker"" chanca piedra",https://www.amazon.com/STONE-BREAKER-Chanca-Piedra-Gallbladder/product-reviews/B01FERIHYE/ref=cm_cr_dp_d_show_all_btm?ie=UTF8&reviewerType=all_reviews,Lindsey Valle,My doctor had told me I was a “stone factory”. Recently went the ER for an unrelated issues and the ER doctor said my kidneys have never looked better. As the had seen me multiple times before for stone issues and surgeries.,5,15,2024-09-09,,1,,1,,,,1,,,,,,,1,,,,,,,,,,,,,,,,,,42,LLM
687,Chanca piedra,Amazon (Playwright),"EU Natural: ""Stone Breaker"" chanca piedra",https://www.amazon.com/STONE-BREAKER-Chanca-Piedra-Gallbladder/product-reviews/B01FERIHYE/ref=cm_cr_dp_d_show_all_btm?ie=UTF8&reviewerType=all_reviews,Otto Von Bismarck,"Same day I received it, same day I took it, same day it came out, never took the medication that the doctor prescribed will buy more if I ever get any more stones which I hope I don’t get anymore of them they hurt like a Bi+¢h",5,20,2024-09-08,,1,,,,,,,,,,,1,,,1,,,,,,,,,,,,,,1,,,47,LLM
688,Chanca piedra,Amazon (Playwright),"EU Natural: ""Stone Breaker"" chanca piedra",https://www.amazon.com/STONE-BREAKER-Chanca-Piedra-Gallbladder/product-reviews/B01FERIHYE/ref=cm_cr_dp_d_show_all_btm?ie=UTF8&reviewerType=all_reviews,Air Force Mike,"I’m really not certain if this product actually worked, but I haven’t had any stones. No side effects, easy to use. It came nicely packaged and in a  reasonable time.",5,8,2024-09-08,,1,,,,,,1,,,,,,,,,,,,,,,,,,,,,,,,,30,LLM
689,Chanca piedra,Amazon (Playwright),"EU Natural: ""Stone Breaker"" chanca piedra",https://www.amazon.com/STONE-BREAKER-Chanca-Piedra-Gallbladder/product-reviews/B01FERIHYE/ref=cm_cr_dp_d_show_all_btm?ie=UTF8&reviewerType=all_reviews,JUAN   A.  CRUZ,This stone breaker  is a life saver.. it works Amazing. Thanks!,5,11,2024-08-25,,1,,,,,,,,,,,,,,,,,,,,,,,,,,,,,,,11,LLM
690,Chanca piedra,Amazon (Playwright),"EU Natural: ""Stone Breaker"" chanca piedra",https://www.amazon.com/STONE-BREAKER-Chanca-Piedra-Gallbladder/product-reviews/B01FERIHYE/ref=cm_cr_dp_d_show_all_btm?ie=UTF8&reviewerType=all_reviews,Midwestern Mama,Time will tell if it works. Kidney stones need surgery but want to get rid of the remaining ones. Great customer support from a seller who cares. The ingredients are healthy. So far no side effects,5,6,2024-08-21,,,,,,,,,,,,,,,,,,,,,,,,,,,,,,,,,36,LLM
691,Chanca piedra,Amazon (Playwright),"EU Natural: ""Stone Breaker"" chanca piedra",https://www.amazon.com/STONE-BREAKER-Chanca-Piedra-Gallbladder/product-reviews/B01FERIHYE/ref=cm_cr_dp_d_show_all_btm?ie=UTF8&reviewerType=all_reviews,Kris Erickson,Chanca Piedra Stone Breaker is an effective remedy. The gelatin capsules make it easy to swallow.,5,4,2024-08-07,,1,,,,,,,,,,,,,,,,capsules,,,,,,,,,,,,,,,16,LLM
692,Chanca piedra,Amazon (Playwright),"EU Natural: ""Stone Breaker"" chanca piedra",https://www.amazon.com/STONE-BREAKER-Chanca-Piedra-Gallbladder/product-reviews/B01FERIHYE/ref=cm_cr_dp_d_show_all_btm?ie=UTF8&reviewerType=all_reviews,Isaias gonzalez,"Interesting product, still taking it. Consistency is key for results. Will keep update if see stone deposits.",5,6,2024-06-25,,,,,,,,,,,,,,,,,,,,,,,,,,,,,,,,,17,LLM
693,Chanca piedra,Amazon (Playwright),"EU Natural: ""Stone Breaker"" chanca piedra",https://www.amazon.com/STONE-BREAKER-Chanca-Piedra-Gallbladder/product-reviews/B01FERIHYE/ref=cm_cr_dp_d_show_all_btm?ie=UTF8&reviewerType=all_reviews,Heath Nelson,"My dog had bladder stones and I bought this by mistake, I contacted customer service with a lot of questions and though this product is not meant for dogs the lady I spoke with answered as many questions with a positive attitude as I could have asked her too",5,2,2024-01-31,,,,,,,,,,,,,,,,,,,,,,,,,,,,,,,,,49,LLM
694,Chanca piedra,Amazon (Playwright),"EU Natural: ""Stone Breaker"" chanca piedra",https://www.amazon.com/STONE-BREAKER-Chanca-Piedra-Gallbladder/product-reviews/B01FERIHYE/ref=cm_cr_dp_d_show_all_btm?ie=UTF8&reviewerType=all_reviews,SuperBigfoot,"This works great and soon. Your poops may be very dark at first. Then return to normal and sink to the bottom of the toilet. (Floaters a sympton of gallbladder not fully functioning). I feel better overall and as if built-up """"poisons"""" being expelled. I feel more relaxed overall. Buy it!",5,48,2024-01-12,,,1,,,,,,,,,,,,,,,,,,,,,,,,,,,,"better poops,more relaxed",,51,LLM
695,Chanca piedra,Amazon (Playwright),"EU Natural: ""Stone Breaker"" chanca piedra",https://www.amazon.com/STONE-BREAKER-Chanca-Piedra-Gallbladder/product-reviews/B01FERIHYE/ref=cm_cr_dp_d_show_all_btm?ie=UTF8&reviewerType=all_reviews,Rishon,"This is life changer, just took for 2 weeks and the stone went away. I wish I knew this earlier. I would like to thank the one who formulated this product.",5,8,2023-11-11,,1,,,,,,,,,,,,,,,,,,,,,,,,,,,,,,,31,LLM
696,Chanca piedra,Amazon (Playwright),"EU Natural: ""Stone Breaker"" chanca piedra",https://www.amazon.com/STONE-BREAKER-Chanca-Piedra-Gallbladder/product-reviews/B01FERIHYE/ref=cm_cr_dp_d_show_all_btm?ie=UTF8&reviewerType=all_reviews,Crankshaft,I have been plagued with kidney stones the last 5 years and get an MRI every year to track them. My Urologist recommends dissolving stones with water and lemonade and did not recommend any OTC drugs. I have taken Tamsulosin on and off as directed by my doctor but it hasn’t helped much lately. On last years MRI I had several 4mm stones and had no movement on them for 10 months so on a whim I bought Stone Breaker to give it a try. About 10 days in I passed a 2 mm stone. Not sure if the Chanca Piedra broke up a larger stone or it was missed on the MRI but I’m gonna continue talking it until my next MRI in 6 weeks and see if it made a difference.Update: I saw my Urologist this week and did a renal X-ray. I went from 5 - 4mm stones to no visible stones after 2 months of taking this product and drinking a lot of water. Thumbs up!,5,71,2023-10-25,,1,,1,,,,,,,,1,,,1,,,,,"4mm stones, 2mm stone",,,,,,,,,1,,,,170,LLM
697,Chanca piedra,Amazon (Playwright),"EU Natural: ""Stone Breaker"" chanca piedra",https://www.amazon.com/STONE-BREAKER-Chanca-Piedra-Gallbladder/product-reviews/B01FERIHYE/ref=cm_cr_dp_d_show_all_btm?ie=UTF8&reviewerType=all_reviews,MizZz,"I continued taking it for over a month and passed a small stone a few days ago. I'm very satisfied, it saved me a lot of money and time.",5,5,2023-10-16,,1,,,,,,,,,,,1,,,,,,,small stone,,,,,,,,,,,,,29,LLM
698,Chanca piedra,Amazon (Playwright),"EU Natural: ""Stone Breaker"" chanca piedra",https://www.amazon.com/STONE-BREAKER-Chanca-Piedra-Gallbladder/product-reviews/B01FERIHYE/ref=cm_cr_dp_d_show_all_btm?ie=UTF8&reviewerType=all_reviews,real tech,"If you poo more often does that mean you’re getting cleaner and the stones are flowing, Ha who knows.",5,5,2023-09-30,,,,,,,,,,,,,,,,,,,,,,,,,,,,,,,,,19,LLM
699,Chanca piedra,Amazon (Playwright),"EU Natural: ""Stone Breaker"" chanca piedra",https://www.amazon.com/STONE-BREAKER-Chanca-Piedra-Gallbladder/product-reviews/B01FERIHYE/ref=cm_cr_dp_d_show_all_btm?ie=UTF8&reviewerType=all_reviews,Charlene,"I am still using it with the hopes my stone will eventually pass without a problem.I am on my forth bottle, and I am also taking dandelion root and milk thistle.. it’s a process I am sure, healing the body naturally.Thank you 😊",5,10,2023-09-28,,,,,,,,,,,,,,,,,,,,,,,,,,,,,,,,,43,LLM
700,Chanca piedra,Amazon (Playwright),"EU Natural: ""Stone Breaker"" chanca piedra",https://www.amazon.com/STONE-BREAKER-Chanca-Piedra-Gallbladder/product-reviews/B01FERIHYE/ref=cm_cr_dp_d_show_all_btm?ie=UTF8&reviewerType=all_reviews,Gustavo,Stone Breaker really helped me.,5,1,2023-09-17,,1,,,,,,,,,,,,,,,,,,,,,,,,,,,,,,,5,LLM
701,Chanca piedra,Amazon (Playwright),"EU Natural: ""Stone Breaker"" chanca piedra",https://www.amazon.com/STONE-BREAKER-Chanca-Piedra-Gallbladder/product-reviews/B01FERIHYE/ref=cm_cr_dp_d_show_all_btm?ie=UTF8&reviewerType=all_reviews,David Mardis,Break up kindey  stones.,5,,2023-09-17,,,,,,,,,1,,,,,,,,,,,,,,,,,,,,,,,,4,LLM
702,Chanca piedra,Amazon (Playwright),"EU Natural: ""Stone Breaker"" chanca piedra",https://www.amazon.com/STONE-BREAKER-Chanca-Piedra-Gallbladder/product-reviews/B01FERIHYE/ref=cm_cr_dp_d_show_all_btm?ie=UTF8&reviewerType=all_reviews,babatunde,Kidney stones,5,,2023-09-10,,,,,,,,,,,,,,,,,,,,,,,,,,,,,,,,,2,LLM
703,Chanca piedra,Amazon (Playwright),"EU Natural: ""Stone Breaker"" chanca piedra",https://www.amazon.com/STONE-BREAKER-Chanca-Piedra-Gallbladder/product-reviews/B01FERIHYE/ref=cm_cr_dp_d_show_all_btm?ie=UTF8&reviewerType=all_reviews,T. Winans,I have used this in the past when I suspected kidney stones. Seems to work well,5,,2023-09-08,,1,,,,,,,,,,,,,,,,,,,,,,,,,,,,,,,16,LLM
704,Chanca piedra,Amazon (Playwright),"EU Natural: ""Stone Breaker"" chanca piedra",https://www.amazon.com/STONE-BREAKER-Chanca-Piedra-Gallbladder/product-reviews/B01FERIHYE/ref=cm_cr_dp_d_show_all_btm?ie=UTF8&reviewerType=all_reviews,Marelin  Simmons,I liked this product because it help break Kidney stones and gave some pain relief.,5,5,2023-08-28,,1,,,,1,,,1,,,,,,,,,,,,,,,,,,,,,,,,15,LLM
705,Chanca piedra,Amazon (Playwright),"EU Natural: ""Stone Breaker"" chanca piedra",https://www.amazon.com/STONE-BREAKER-Chanca-Piedra-Gallbladder/product-reviews/B01FERIHYE/ref=cm_cr_dp_d_show_all_btm?ie=UTF8&reviewerType=all_reviews,Connie Jarnagin,Seems to work and I have tried everything.,5,,2023-08-02,,1,,,,,,,,,,,,,,,,,,,,,,,,,,,,,,,8,LLM
706,Chanca piedra,Amazon (Playwright),"EU Natural: ""Stone Breaker"" chanca piedra",https://www.amazon.com/STONE-BREAKER-Chanca-Piedra-Gallbladder/product-reviews/B01FERIHYE/ref=cm_cr_dp_d_show_all_btm?ie=UTF8&reviewerType=all_reviews,Clarisa,"This is the first review I have ever made on any product. I hope my review will bring you hope if you are struggling with kidney stones.It started in the summer of 2022 when I was 4 months pregnant. At the time, it was UTI like symptoms. Due to my pregnancy, I was unable to take any type of herbal supplements I was just given pain medication. I dealt with the intolerable pain for two months and when I was 6 months pregnant I had emergency removal of 2 stones one on each side- 0.5mm and 0.8mm following stent placement for a week and stent removal and yes- that felt like I was giving birth. MRI performed before the removal of the stones showed I had 2 smaller stones on each kidney which were not removed during the procedure.Fast forward a year later- July 2023 I started with UTI like symptoms once again. I knew right away they were the kidney stones. I went to my urologist to test for a UTI and she confirmed there was indeed blood in urine confirming stones. I decided to try this product as it was my only and last hope as I was preparing myself for yet another removal procedure and financial strain on my savings. Ordered on Sunday night, product arrived on Tuesday and took as followed:1. Tuesday night- I had excruciating pain (pain level 9). It got worse when I took a glass with lime. Flank pain started and I took two supplements. Thirty minutes later I had very little to no urine and my bladder was hurting. I was debating whether to go to the ER. About 45 min into the pain I felt sharp pinching as the stone was moving down my urethra. Immediately after the sharp pinching feeling I was able to urinate.  Pain diminished slowly and was able to rest for the night.2. Wednesday morning- While fasting as soon as I woke up I took another glass with lime and added apple cider vinegar. I took one supplement with it. I was feeling ok throughout the morning with mild UTI like burning symptoms. By the afternoon after having some lunch, I had another glass with lime and apple cider vinegar. My pain increased to sharp pinching feeling in my urethra and pressure. I knew the stone was there and was a matter of time before I urinated it out. About an hour into my pain when laying down the sharp feeling intensified and all of a sudden it was gone- instant relief?! I ran to the restroom I heard a clank on the toilet bowl and there it was the stone!I will continue to take this to hopefully dissolve the others out. I highly recommend this product along with taking it with lime water and apple cider vinegar. I hope to never look back on kidney stone surgery removal and I hope you never have to go through that. God bless.",5,2,2023-07-27,,1,,1,,,,,,,,1,1,,,1,,,,0.5mm and 0.8mm stones,,,,,,,,,1,,,,494,LLM
707,Chanca piedra,Amazon (Playwright),"EU Natural: ""Stone Breaker"" chanca piedra",https://www.amazon.com/STONE-BREAKER-Chanca-Piedra-Gallbladder/product-reviews/B01FERIHYE/ref=cm_cr_dp_d_show_all_btm?ie=UTF8&reviewerType=all_reviews,cricket vonjames,"I am amazed at the results of this Kidney clease herbal supplement. I am 57 now and my right Kidney that has had several calcium stones, one even surgically removed and has a lot of problems. But taking 2 of these a day has at least taken the pain away. Not sure of all benefits but I sure am happy to not be in pain all the time.",5,16,2023-07-23,,1,,1,,1,,,,,,,,,,,,,2 daily,calcium stones,,,,,,,,,,,,,68,LLM
708,Chanca piedra,Amazon (Playwright),"EU Natural: ""Stone Breaker"" chanca piedra",https://www.amazon.com/STONE-BREAKER-Chanca-Piedra-Gallbladder/product-reviews/B01FERIHYE/ref=cm_cr_dp_d_show_all_btm?ie=UTF8&reviewerType=all_reviews,Donald Cherenfant,"Great product. I started to feel pain in my right and left sides along with my right private area. I figured it was kidney stone. I did some reached and they recommend this product on Google. I received it the same day. Within two days of taking it, the pain was gone.",5,15,2023-07-12,,1,,,,1,,,,,,,,,,1,,,,,,,,,,,,,,,,,52,LLM
709,Chanca piedra,Amazon (Playwright),"EU Natural: ""Stone Breaker"" chanca piedra",https://www.amazon.com/STONE-BREAKER-Chanca-Piedra-Gallbladder/product-reviews/B01FERIHYE/ref=cm_cr_dp_d_show_all_btm?ie=UTF8&reviewerType=all_reviews,Colette,I saw stones.,5,,2023-06-26,,1,,,,,,,,,,,,,,,,,,,,,,,,,,,,,,,3,LLM
710,Chanca piedra,Amazon (Playwright),"EU Natural: ""Stone Breaker"" chanca piedra",https://www.amazon.com/STONE-BREAKER-Chanca-Piedra-Gallbladder/product-reviews/B01FERIHYE/ref=cm_cr_dp_d_show_all_btm?ie=UTF8&reviewerType=all_reviews,Tomina green,My hubby suffers from kidney stone I found these on Amazon and decided to purchase it for him he has passed not one or two but three in just three days this product is the truth,5,12,2023-06-26,,1,,,,,,,,,,,1,,,,,,,3 stones,,,,,,,1,,,1,,,36,LLM
711,Chanca piedra,Amazon (Playwright),"EU Natural: ""Stone Breaker"" chanca piedra",https://www.amazon.com/STONE-BREAKER-Chanca-Piedra-Gallbladder/product-reviews/B01FERIHYE/ref=cm_cr_dp_d_show_all_btm?ie=UTF8&reviewerType=all_reviews,Paul Henry,NO MORE. Thanks Stone Breaker,5,,2023-06-24,,1,,,,,,,,,,,,,,,,,,,,,,,,,,,,,,,5,LLM
712,Chanca piedra,Amazon (Playwright),"EU Natural: ""Stone Breaker"" chanca piedra",https://www.amazon.com/STONE-BREAKER-Chanca-Piedra-Gallbladder/product-reviews/B01FERIHYE/ref=cm_cr_dp_d_show_all_btm?ie=UTF8&reviewerType=all_reviews,Gordy,"Had a minor bout of kidney stones and was cramping both day and night. Worse at night and was causing me to lose sleep. I started these on Sunday morning. Still couldn't sleep that night, but Monday night finally no more cramping. Made me start urinating more so it definitely helps start the process of cleaning out the pipes.",5,6,2023-06-14,,1,,,,1,,,,,,,,,,1,,,,,,,,,,,,,,,,,59,LLM
713,Chanca piedra,Amazon (Playwright),"EU Natural: ""Stone Breaker"" chanca piedra",https://www.amazon.com/STONE-BREAKER-Chanca-Piedra-Gallbladder/product-reviews/B01FERIHYE/ref=cm_cr_dp_d_show_all_btm?ie=UTF8&reviewerType=all_reviews,Nicholas Goldsack,"I was told by my physician that I may have a kidney stone, to avoid the pain and anxiety of what I would be experiencing by passing the stone, I read about these pills and figured give it a try. It said for best results take them for 8 weeks. So far do good I’m on the first bottle,",5,4,2023-06-13,,,,,,,,,,,,,,,,,,pills,,,,,,,,,,,,,,,59,LLM
714,Chanca piedra,Amazon (Playwright),"EU Natural: ""Stone Breaker"" chanca piedra",https://www.amazon.com/STONE-BREAKER-Chanca-Piedra-Gallbladder/product-reviews/B01FERIHYE/ref=cm_cr_dp_d_show_all_btm?ie=UTF8&reviewerType=all_reviews,Rob,depends on what kidney stones you has it will break them but still had to go to the doctor.,5,2,2023-05-20,,1,,,,,,,1,,,,,,,,,,,,,,,,,,,,,,,,19,LLM
715,Chanca piedra,Amazon (Playwright),"EU Natural: ""Stone Breaker"" chanca piedra",https://www.amazon.com/STONE-BREAKER-Chanca-Piedra-Gallbladder/product-reviews/B01FERIHYE/ref=cm_cr_dp_d_show_all_btm?ie=UTF8&reviewerType=all_reviews,Damaris,"I ended up in the ER for bad pain come to find out I had kidney stones, was given pain medication and sent home. I started searching for remedies or anything to pass a kidney stone and came accross this product so I ordered them the next morning of, they arrived the same day so I started taking them on that thursday (twice a day) Sunday morning (2:29am) I passed the kidney stone !!!",5,12,2023-05-15,,1,,,,,,,,,,,1,,,,,,twice daily,,,,,,,,,,,,,,74,LLM
716,Chanca piedra,Amazon (Playwright),"EU Natural: ""Stone Breaker"" chanca piedra",https://www.amazon.com/STONE-BREAKER-Chanca-Piedra-Gallbladder/product-reviews/B01FERIHYE/ref=cm_cr_dp_d_show_all_btm?ie=UTF8&reviewerType=all_reviews,Geri,So i bought this product and chancapiedra tea .2 days before start this i was with crisis at emergency room i started this next day.i felt that this broked the stone because in aternoon i had problem with peeing but the other day in morning i felt better and in afternoon the stone came out .so maybe this works and by itself but always i drinked 2 pills of this and during the day i was consuming chancapiedra tea instead of water and worked for me in 1 day after started,5,13,2023-05-15,,1,,,,,,,1,,,,1,,,1,,pills,2 pills daily,,,,,,,,,,,,,,91,LLM
717,Chanca piedra,Amazon (Playwright),"EU Natural: ""Stone Breaker"" chanca piedra",https://www.amazon.com/STONE-BREAKER-Chanca-Piedra-Gallbladder/product-reviews/B01FERIHYE/ref=cm_cr_dp_d_show_all_btm?ie=UTF8&reviewerType=all_reviews,Leigh B.,"I'm like a lot of people on here - I typically don't write reviews, but this stuff really helps! I passed a stone a couple of months back, and it was the worst pain of my life. I ordered these the same day for any others that might have been in there, and within 24 hours I could really tell that they were breaking something up in my kidneys, but whatever else was in there passed with no pain. I went to a doctor and had an X ray done a few days later, along with that other test that they do for kidney stones that I am too embarrassed to describe here, and I was totally clear. Great product!",5,21,2023-05-12,,1,,,,,,,1,,,,1,,,1,,,,,,,,,,,,,,,,,120,LLM
718,Chanca piedra,Amazon (Playwright),"EU Natural: ""Stone Breaker"" chanca piedra",https://www.amazon.com/STONE-BREAKER-Chanca-Piedra-Gallbladder/product-reviews/B01FERIHYE/ref=cm_cr_dp_d_show_all_btm?ie=UTF8&reviewerType=all_reviews,Pamela M.,I have been a kidney stone maker for many years.  This one has been hanging around not wanting to exit and irritating my urinary tract for more than a month.  After seeing how big it was I know why.  I purchased Stine Breaker about a week ago to see it it would help.  Sure seems like it did!,5,21,2023-05-08,,1,,1,,,,,,,,,1,,,,,,,,,,,,,,,,,,,,58,LLM
719,Chanca piedra,Amazon (Playwright),"EU Natural: ""Stone Breaker"" chanca piedra",https://www.amazon.com/STONE-BREAKER-Chanca-Piedra-Gallbladder/product-reviews/B01FERIHYE/ref=cm_cr_dp_d_show_all_btm?ie=UTF8&reviewerType=all_reviews,Michaela Ford,"I've been taking these for 6 months on and off again. I don't know why I stop because every time I start back up again, I start peeing out more stones. This has been better than anything any doctor has suggested.",5,13,2023-04-23,,1,,,,,,,,,,,,Better than: doctor suggestions,,,,,,,,,,,,,,,,,,,41,LLM
720,Chanca piedra,Amazon (Playwright),"EU Natural: ""Stone Breaker"" chanca piedra",https://www.amazon.com/STONE-BREAKER-Chanca-Piedra-Gallbladder/product-reviews/B01FERIHYE/ref=cm_cr_dp_d_show_all_btm?ie=UTF8&reviewerType=all_reviews,Dana Bowker,As of today I'm rid of my 5mm stone that caused me grief last month. I tried flomax but it wasn't really working. And than I tried these pills out and they helped to pass my stone!,5,12,2023-04-22,,1,,,,,,,,,,,1,Better than: flomax,,,,pills,,5mm stone,,,,,,,,,,,,,37,LLM
721,Chanca piedra,Amazon (Playwright),"EU Natural: ""Stone Breaker"" chanca piedra",https://www.amazon.com/STONE-BREAKER-Chanca-Piedra-Gallbladder/product-reviews/B01FERIHYE/ref=cm_cr_dp_d_show_all_btm?ie=UTF8&reviewerType=all_reviews,Chris Daniel,I purchased this product because I felt like I was having a kidney stone passing through my urinary tract. At first I thought it was an infection but turned out to be a stone. As soon as I received it I took the suggested amount and an hour later I passed my first stone. The next day I had a similar feeling so it took this again and out came the second. Needless to say it was a bit painful but this stuff really helped!!! Would suggest to anyone who is having the same problem as me!,5,10,2023-04-21,,1,,,,,,,,,,,1,,,1,,,suggested amount,2 stones,,,,,,,,,,,,,97,LLM
722,Chanca piedra,Amazon (Playwright),"EU Natural: ""Stone Breaker"" chanca piedra",https://www.amazon.com/STONE-BREAKER-Chanca-Piedra-Gallbladder/product-reviews/B01FERIHYE/ref=cm_cr_dp_d_show_all_btm?ie=UTF8&reviewerType=all_reviews,Cory Lam,It is easy to take and easy to swallow.  There is no after taste.,5,1,2023-04-17,,,,,,,,,,,,,,,,,,,,,,,,,,,,,,,,,14,LLM
