product,productName,reviewerName,title,date,verifiedPurchase,stars,text,helpful,size
Potassium citrate,Swanson Potassium Citrate,Michael P. Sandler,5.0 out of 5 stars,"Reviewed in the United States on January 7, 2021",true,5.0 out of 5 stars,"I take this product to prevent a reoccurrence of kidney stones.  Thank God, I haven't had any more kidney stones since I have been taking this product.",2 people found this helpful,Item Package Quantity: 1
Potassium citrate,Swanson Potassium Citrate,Robert MacIntel,5.0 out of 5 stars,"Reviewed in the United States on June 29, 2018",true,5.0 out of 5 stars,"Having had two extremely scary episodes with Kidney Stones over the past years - I decided to combat them by drinking a lot of water with organic LIME juice added, plus I take 2 of these AM and 2 more PM every day.  Since adding these supplements to the water with lime juice, I have not experienced a recurrance of the Kidney Stones.",11 people found this helpful,Item Package Quantity: 1
Potassium citrate,Swanson Potassium Citrate,J.Adams,5.0 out of 5 stars,"Reviewed in the United States on August 23, 2017",true,5.0 out of 5 stars,I've taken potassium supplements for years for kidney stones and horrible foot cramps. I take a couple of these every day and no problems. It's something I can't be without and for the price and quality this product is great.,4 people found this helpful,Item Package Quantity: 1
Potassium citrate,Swanson Potassium Citrate,Amazon Customer,5.0 out of 5 stars,"Reviewed in the United States on March 6, 2016",true,5.0 out of 5 stars,"great price, delivered quickly. had a kidney stone - never again, this supplement was recommended - so far so good",7 people found this helpful,Item Package Quantity: 1
Potassium citrate,Swanson Potassium Citrate,AReg,5.0 out of 5 stars,"Reviewed in the United States on February 20, 2013",true,5.0 out of 5 stars,"Got a uric acid kidney stone that got stuck in my uterer and required a stent be inserted.  After doing so online research, I used the potassium citrate to help with dissolving the stone and it worked (along with a lot of fluids every day for 3 months).  The urologist insisted that the stone was still there, but when they pulled the stent, it was gone.",10 people found this helpful,Item Package Quantity: 1